[
  {
    "title": "按下快门的理由",
    "date": "2026-07-20",
    "draft": false,
    "tags": [
      "摄影"
    ],
    "body": "拍照走路时不看地图。本来就没有目的地，看了也没用。\n\n有元慎也的这句话，是我拿起相机的原点。街头的每一帧都不是计划好的——是走出来的，等出来的，碰上的。\n\n相机不是工具，是另一双眼睛。"
  },
  {
    "title": "从郑州到东京",
    "date": "2026-06-15",
    "draft": false,
    "tags": [
      "旅行",
      "摄影"
    ],
    "body": "两个城市的节奏完全不同。郑州是快板，东京是行板。但取景框里的世界，在哪都一样安静。"
  }
]